title,content,publishedAt,url
"This New Neighborhood Will Grow Its Own Food, Power Itself, And Handle Its Own Waste","The village will be located on the outskirts of Almere, a quickly growing town 20 minutes by train from Amsterdam, and will grow about half of the food they eat— excluding coffee or bananas, for instance (although the company believes in some locations, the neighborhood could actually be fully self-sufficient). The community will also feed energy back to the local grid.  While they plan to expand everywhere, they currently have planned projects in Sweden, Norway, Denmark, and Germany. They would even like to adapt the system for arid climates such as the Middle East.
From the Fast Coexist article:
“By using the most advanced methods for growing food—a combination of aeroponics, aquaponics, permaculture, food forests, and high-yield organic farming—the neighborhood will grow many times more food than a traditional farm of the same size, with fewer resources. Aquaponics, for example, can produce 10 times as much produce on the same amount of land, with 90% less water.
Any household waste that can be composted will feed livestock or soldier flies. The soldier flies will feed fish, and fish waste will fertilize an aquaculture system that produces fruit and vegetables for the homes. Seasonal gardens will be fertilized by waste from the livestock.”
James Ehrlich, CEO of RenGen Villages, anticipates tons of “abundant, organic food” (vegetables, fruit, nuts, legumes, fish, eggs, chicken, small animal dairy and protein) every year from the community. In fact, in order to supplement their seasonal gardens they will use vertical garden systems all year long. The Danish architecture firm, Effekt, helped them on the design.
They will produce their own energy by using a mixture of geothermal, solar, solar thermal, wind, and biomass. Ehrlich says they are even looking at certain technologies for small-footprint biomass that use farm waste and turn it into a consistent energy source- even in the dead of winter. A smart grid will distribute power efficiently throughout the community, sending it to a carport to charge shared electric cars as needed.
There is a biogas plant planned that will turn any non-compostable household waste into power and water and their water storage system will collect rainwater and graywater to redistribute it to seasonal gardens and the aquaponic system.
Ehrlich says, “We’re really looking at a global scale. We are redefining residential real-estate development by creating these regenerative neighborhoods, looking at first these greenfield pieces of farmland where we can produce more organic food, more clean water, more clean energy, and mitigate more waste than if we just left that land to grow organic food or do permaculture there,” reports Fast Coexist.
The community in Almere will break ground this summer and is slated to be finished in 2017! This is exciting. I would LOVE to have one of these communities show up here in the states.
What about you? Would you live in a community like this?
Source: Fast Coexist","Jun 20, 2016",https://www.healthnutnews.com/new-neighborhood-will-grow-food-power-handle-waste/
Oregon Gov. Kate Brown Orders All Schools to Close Until April to Slow Coronavirus,"Turning to a “last resort” she hoped to avoid, Oregon Gov. Kate Brown Thursday night ordered all schools closed for at least two weeks to help stop the spread of the novel coronavirus. The move will affect 583,000 students. 
The stunning order will close schools from Monday, March 16, until Tuesday, March 31. Brown said in announcing her decision that students would return to class on Wednesday, April 1. She said in her statement:
“I have heard from superintendents, school board members, teachers, parents, and students that it has now become impossible to functionally operate schools due to workforce issues and student absences.”
Channel 4: Coronavirus: China Using App to Track Quarantined Citizens
Channel 4: Coronavirus: China Using App to Track Quarantined Citizens
The development will disrupt life not only at schools but in homes and businesses across Oregon as thousands of parents face the prospect of children at home. The closure will be especially challenging for low-income or homeless families whose children count on free meals from school. The governor, who said she was left with little choice, remarked:
“So many of our families depend on school in order for parents to go to their jobs, and for students to access health care and receive nutrition.”
“I want to be very clear. Sending Oregon children home will not stop the spread of the coronavirus.”

FORBES: New York Is Making Its Own Hand Sanitizer Using Inmate Labor to Fight The Coronavirus Outbreak
FORBES: New York Is Making Its Own Hand Sanitizer Using Inmate Labor to Fight The Coronavirus Outbreak
Oregon is not the only state to issue statewide closures. Michigan, Ohio and Maryland have done the same, and another 21 states have closed some schools as federal and state officials deal with what has now been termed a global pandemic.
John Larson, president of the Oregon Education Association, said in a statement:
“It is critical that our students who rely on our public schools for their only reliable nutritious meal in a day continue to receive access to those meals. It is essential the governor’s office release guidance instructing school districts to keep public school employees financially whole during the closing of schools. Oregon’s students and educators should not have to bear the burden of a public health outbreak that is far beyond their control.”
Brown acted just hours after a news conference where she announced state restrictions against gatherings of 250 people or more. She said then that it was “critically important” for schools to remain open and said she was heeding the advice of public health experts in deciding to leave schools open. State officials, however, did advise schools to cancel most group activities, including parent-teacher conferences, field trips, and school programs. Those restrictions still apply to school systems remaining open.
INDEPENDENT: Coronavirus: Space Images Reveal Drastic Fall in Pollution Over China as Factories Closed
INDEPENDENT: Coronavirus: Space Images Reveal Drastic Fall in Pollution Over China as Factories Closed
Brown anticipated the need to close Oregon schools in a letter Wednesday to Vice President Mike Pence that sought federal help on several fronts with money and supplies. Among her requests was a relaxation of federal rules governing meals provided in schools heavily populated by low-income students. She also asked permission for closed schools to distribute food supplies to local food banks, adding:
“This is an important tool to ensure that low-income students and their families who qualified for free or reduced price meals do not go hungry when schools close.”
In her announcement Thursday night, Brown said that “districts are tasked with developing plans to continue nutrition services during the closure.” Brown also asked for federal help for child care providers “to prevent the collapse of the overall child care business, further depleting the supply of affordable child care in the state.”
While young children and teenagers are among the least vulnerable to the virus — the majority of fatalities have been recorded in people older than 60 — public health experts have said preventing crowds from gathering is one of the most effective ways to slow the spread of the disease and keep hospitals and health care workers from becoming overwhelmed by serious cases.
Oregon Live","Mar 13, 2020",https://www.healthnutnews.com/oregon-gov-kate-brown-orders-all-schools-to-close-until-april-to-slow-coronavirus/
"BREAKING: Harvard, Vanderbilt, and Other Universities Cancel In-Person Classes; Students Must Move Out By Sunday","Universities from California to New York have closed campus classrooms as the novel coronavirus has affected more than 100,000 people across the globe and its spread has officially transformed into a pandemic.
Vanderbilt University, along with Harvard and a growing list of other universities, has canceled all in-person classes for the rest of the semester. All undergraduate Vandy students living on campus must move out by Sunday.
At some universities, online instruction is being offered for a limited period, or through the semester. Depending on the laws in their state, some schools are telling students to not return to campus for 14 days after their return.
Vanderbilt’s closing comes after a Vanderbilt University Medical Center employee tested positive for COVID-19. Online classes and alternative learning courses will launch Monday for all students. An email was sent out to students and staff from Interim Chancellor Susan Wente.
Read the full statement from Wente below:
Dear Vanderbilt community,
Today, we received notice from Vanderbilt University Medical Center that a VUMC health care worker has tested positive for COVID-19. Out of an abundance of caution and based on public health recommendations and best practices, we will move fully to online and alternative learning for the remainder of the semester.
Given that, all undergraduate residential students should make plans to move out by March 15. We are actively working on plans to assist undergraduate residential students with move out and are evaluating an approach to address on-campus housing and dining fees for the remaining month of classes. We will send details about those plans to the students and families. Students who need to remain on campus beyond this date will receive further information.
Classes remain cancelled for the remainder of this week. Online and alternative learning will launch Monday, March 16, for undergraduate, graduate and professional students. Faculty and graduate assistants should coordinate directly with their deans and department chairs, and staff with their managers, with questions.
Be assured that our campus remains safe and open. We are continuing our cleaning, sanitizing, social distancing and other best practices to keep our campus safe.
I know this news will raise many questions specific to your situation. We are now preparing detailed information, guidance and resources for all students, faculty, staff and postdoctoral scholars. We will share that information as soon as it is available.
This is not how any of us wanted this semester to proceed, but we are acting now to ensure the health and safety of all members of our community. While our campus is the heart of this university, our people are its soul. This challenging situation is necessitating a temporary change to how we deliver education, but it will not deter us from the pursuit of our mission.
I remind you that all of the rest of our policies and guidelines remain in place. Please closely monitor the university’s COVID-19 website—all updates, policies and a detailed FAQ will continue to be posted to that site. Contact [email protected] with questions.
With much appreciation,
Susan R. Wente Interim Chancellor and Provost
WKRN
CNN","Mar 11, 2020",https://www.healthnutnews.com/breaking-abc-vanderbilt-university-cancels-in-person-classes-for-rest-of-semester-students-must-move-out-by-sunday/
FORBES: New York Is Making Its Own Hand Sanitizer Using Inmate Labor to Fight The Coronavirus Outbreak,"New York state governor Andrew Cuomo announced today that the state is making its own hand sanitizer product in an attempt to curb the spread of SARS-CoV-2, the novel coronavirus which has currently infected over 100,000 people worldwide, resulting in around 3,800 deaths so far. 
Cuomo indicated the move is also to circumvent price-gouging of hand sanitizer. He claimed that the product is superior to others available due to a 75% alcohol content, greater than many other brands on the market. He said in a press briefing:
“We are introducing New York State clean hand sanitizer, made conveniently by the state of New York.”

The product is manufactured by Corcraft Products, which is run by the Department of Correctional Services, Division of Industries. The state plans to make 100,000 gallons per week using labor from inmates of New York’s prison system. According to their website, the organization claims to “employ inmates in substantive jobs that help teach a good work ethic and valuable work skills.”
As of Monday, New York State confirmed 142 cases of COVID-19, with most focused in the Westchester region of the state. New York declared a state of emergency on Saturday, when the number of people with confirmed COVID-19 was 89. According to Governor Cuomo, 8 of the 142 cases are currently hospitalized.
Forbes
I use and highly recommend Air Doctor. AirDoctor is the affordable prescription for healthy, clean indoor air. XO ~ Erin","Mar 10, 2020",https://www.healthnutnews.com/new-york-is-making-its-own-hand-sanitizer-using-inmate-labor-to-fight-the-coronavirus-outbreak/
INDEPENDENT: Coronavirus: Space Images Reveal Drastic Fall in Pollution Over China as Factories Closed,"Satellite images over China show a dramatic reduction in pollution after the coronavirus outbreak shut down large portions of the country’s industry and travel.
According to Nasa, the change was at least partly related to the economic slowdown caused by efforts to contain the virus.
Closing industrial plants and urging people to stay home has led to sharp drops in the burning of fossil fuels, which is the world’s largest greenhouse gas producer. In mid-February, scientists observed that the coronavirus put a stop to at least a quarter of China’s greenhouse gas emissions in just two weeks.
A Natural Gas Blowout in Ohio Released More Methane than Many Countries do in an Entire Year
A Natural Gas Blowout in Ohio Released More Methane than Many Countries do in an Entire Year
Nasa maps show how levels of the toxic gas nitrogen dioxide – from vehicles, power plants, and factories – plummeted after the mass quarantine, compared to what they previously were.

A planet in crisis: Here’s how you can help
A planet in crisis: Here’s how you can help
The outbreak began in China, where there are more than 80,000 cases of coronavirus, by far the most significant number of any country, with a little over 2,900 deaths.
Maps from Nasa compare pollution levels between the first three weeks of the year and 10-25 February.
Nasa scientists said the drop in pollution was first visible near Wuhan, the source of the outbreak, but ultimately spread across the country.
Fei Liu, an air quality researcher at Nasa’s Goddard Space Flight Center, said she had seen a decline in nitrogen dioxide levels during the economic recession of 2008 but said that decrease was more gradual, adding:
“This is the first time I have seen such a dramatic drop-off over such a wide area for a specific event.”
Independent","Mar 2, 2020",https://www.healthnutnews.com/independent-coronavirus-space-images-reveal-drastic-fall-in-pollution-over-china-as-factories-closed/
Channel 4: Coronavirus: China Using App to Track Quarantined Citizens,"As China’s President visits Wuhan on a victory tour, Channel 4’s International Editor Lindsey Hilsum takes a look at one of the controversial measures China is using to track its quarantined citizens. 

Channel 4","Mar 12, 2020",https://www.healthnutnews.com/channel-4-coronavirus-china-using-app-to-track-quarantined-citizens/
Netflix Viewers Freaked Out as ‘Pandemic’ Documentary Happens to Drop Amid Coronavirus Outbreak,"Netflix just released a brand new Pandemic docuseries amid the Coronavirus outbreak. And it has wreaked havoc among its viewers.
The six-part series show, which debuted on Netflix earlier this week, is called ‘Pandemic: How To Prevent An Outbreak’. It travels the earth to investigate potential viruses that could conceivably spread throughout an entire country or even the world, and whether or not we’d be able to manage such a pandemic.
Pandemic ‘could wipe out 900 million people,’ experts warn
Pandemic ‘could wipe out 900 million people,’ experts warn

Is China ground zero for a future pandemic?
The director of USAID’s Emerging Threats Unit, Dr. Dennis Carroll, delivers a frightening message, saying:
When we talk about another flu pandemic happening, it’s not a matter of if, but when.1
What we can learn 100 years after the Spanish Influenza pandemic of 1918
But their efforts have not comforted everyone. Fearful fans have flocked to Twitter as the show’s airing coincided with the Coronavirus. Viewers wrote on Twitter:
‘Between this coronavirus outbreak and everyone I know having the flu, Netflix just dropped a new documentary series called “Pandemic” to scare us all even more. It’s creepy how @netflix just released a docu-series called “Pandemic” at the same time the #CoronaVirus is spreading.’1
Others quipped that they’d be more scared if The Simpsons were dealing with a Pandemic after their history of creepily accurate predictions.
‘I have seen the @netflix mini-docu about the next pandemic and with the Coronavirus, it’s super relevant to watch. BUT I will start worrying about it when @TheSimpsons make an episode about it.’1
Metro UK","Jan 26, 2020",https://www.healthnutnews.com/netflix-viewers-freaked-out-as-pandemic-documentary-happens-to-drop-amid-coronavirus-outbreak/
Thousands of Gallons of Fuel Are Being Burned While Planes Fly Empty,"Due to aviation rules in Europe that state airlines operating out of the continent risk losing their business to competitors if they don’t continue to run 80% of their allocated slots, thousands of gallons of fuel have been wasted while planes fly empty amid the coronavirus outbreak.
The Times of London reported that UK Transport Secretary Grant Shapps wrote a letter to Airport Coordination Limited, requesting that the rules be suspended, stating his concerns for even greater economic and environmental damage. Shapps wrote:
“I am particularly concerned that, in order to satisfy the 80/20 rule, airlines may be forced to fly aircraft at very low load factors, or even empty, in order to retain their slots. Such a scenario is not acceptable. It is not in the industry’s, the passengers’ or the environment’s interest and must be avoided.”
Flying should come with a health warning
Flying should come with a health warning

Airport Coordination Limited did suspend the rules for flights in and out of Hong Kong and China, however, the 80/20 rule remains in place for all other flights. According to The International Air Transport Association, the outbreak is projected to cost the airline industry up to $113 billion worldwide — losses similar to those the airline industry experienced in 2008, during the global financial crisis. Taking the brunt of the financial burden would be airlines in Europe and Asia.
FOX: Man Forced to Take Unlabeled Pills on SW Airlines Flight According to Witnesses. He Did Not Have the Coronavirus
FOX: Man Forced to Take Unlabeled Pills on SW Airlines Flight According to Witnesses. He Did Not Have the Coronavirus
As of March 9th around 2pm EST, there have been 111,156 confirmed cases of coronavirus across 106 countries, and 3,888 deaths. In the United States, 617 cases have been confirmed, along with 22 deaths. Experts estimate that if the virus is contained soon, aviation industry losses could total around $63 billion. However, as it continues to spread, the economic impact continues to worsen.
*Article originally appeared at Mercola.","Mar 12, 2020",https://www.healthnutnews.com/thousands-of-gallons-of-fuel-are-being-burned-while-planes-fly-empty/
FOX: Trump Announces Travel Ban From Europe Amid Growing Fears of Coronavirus,"Taking drastic action on Wednesday, President Donald Trump announced he is cutting off travel from 26 European nations to the U.S. and moving to ease the economic cost of a viral pandemic that is disturbing global financial markets and interrupting the daily lives of Americans.
Speaking from the Oval Office, Trump made the announcement that he is suspending all travel from Europe to the U.S. for 30 days, beginning late Friday, at midnight. Trump said:
“We made a lifesaving move with early action on China. Now we must take the same action with Europe.”
Trump said the restrictions wouldn’t apply to the United Kingdom, and there would be exemptions for “Americans who have undergone appropriate screenings.” He stated the U.S. would monitor the situation to determine if travel could resume earlier. He added:
“The virus will not have a chance against us. No nation is more prepared, or more resilient. We are all in this together. We must put politics aside, stop the partisanship and unified together as one nation, and one family.”
FORBES: New York Is Making Its Own Hand Sanitizer Using Inmate Labor to Fight The Coronavirus Outbreak
FORBES: New York Is Making Its Own Hand Sanitizer Using Inmate Labor to Fight The Coronavirus Outbreak
The announcement came on a day when, after the WHO declared the global crisis a pandemic, communities canceled public events nationwide, universities moved to cancel in-person classes, and families wrestled with the school closings. The number of confirmed cases of the infection in the U.S. topped 1,000.

INDEPENDENT: Coronavirus: Space Images Reveal Drastic Fall in Pollution Over China as Factories Closed
INDEPENDENT: Coronavirus: Space Images Reveal Drastic Fall in Pollution Over China as Factories Closed
Congress unveiled a multibillion-dollar aid package Wednesday that was expected to be voted on by the House as soon as Thursday. Dr. Anthony Fauci, director of the National Institute of Allergy and Infectious Disease, said in testimony before the House Oversight and Reform Committee:
“I can say we will see more cases, and things will get worse than they are right now. (The coronavirus is) Ten times more lethal than the seasonal flu.”
In anticipation of his remarks, White House aides tried to determine what action the president could take unilaterally and what required congressional action, as Trump personally weighed the public and political reactions to the prospects before him.
Trump said he was also directing agencies to provide undefined financial relief for “for workers who are ill, quarantined or caring for others due to coronavirus,” and asked Congress to take action to extend it.
Trump said the Small Business Administration would also make low-interest loans available to businesses to help them weather the storm. He said the U.S. would defer tax payments for some individual and business filers for three months to lessen the impacts of the virus outbreak. He added:
“This is not a financial crisis. This just a temporary moment of time that we will overcome together as a nation and as a world.”
NY Post: North Korean Official Reportedly Executed for Breaking Coronavirus Quarantine
NY Post: North Korean Official Reportedly Executed for Breaking Coronavirus Quarantine
Trump also reiterated his call on Congress to pass a cut to the federal payroll tax in order to stimulate the economy. However, that proposal was dismissed by many lawmakers on both sides of the aisle. He remained silent on his previous calls to assist industries hard-hit by the pandemic like airlines and cruise ships.
An economic assistance plan was unveiled on Capitol Hill that was gaining bipartisan backing. Fundamental to the package is free coronavirus testing nationwide and emergency funding to reimburse lost paychecks for those self-quarantining, missing work, or losing jobs amid the outbreak. Treasury Secretary Steven Mnuchin, whom Trump tapped to negotiate with Nancy Pelosi, urged Congress “to pass legislation quickly.” Mnuchin said of the crisis:
“This is a little bit like a hurricane, and we need to cover these outside of normal expenses.”
For most people, the new coronavirus causes only mild or moderate symptoms, such as fever and cough. For some, especially older adults and people with existing health problems, it can cause more severe illness, including pneumonia.
Updated Every Minute, 17-Year-Old Whiz Kid’s Coronavirus Site Used by Millions
Updated Every Minute, 17-Year-Old Whiz Kid’s Coronavirus Site Used by Millions
The vast majority of people recover from the new virus. According to the World Health Organization, people with mild illness recover in about two weeks, while those with more severe illness may take three to six weeks to recover.
Congress’ attending physician told staff there could be 70 million to 100 million coronavirus cases in the U.S. That’s on track with other estimates. A Harvard official has estimated that 20 percent to 60 percent of adults will get the virus, noting it’s “a pretty wide range.”
Fox
New York Times","Mar 11, 2020",https://www.healthnutnews.com/fox-trump-announces-travel-ban-from-europe-amid-growing-fears-of-coronavirus/
