title,content,publishedAt,url
NY Post: North Korean Official Reportedly Executed for Breaking Coronavirus Quarantine,"A North Korean trade official has reportedly been executed by firing squad for going to a public bath, in violation of his 14-day coronavirus quarantine after having returned from China.
According to the New York Post, the trade official had been placed in isolation after traveling to China. The report said the official was arrested and immediately executed for endangering the country’s population.
The execution came on the heels of North Korean leader Kim Jong Un’s decision to close off its borders to China on January 30 and impose “rule by military law” against anyone who leaves without permission. The report also suggested that another official who tried to conceal his travel history to China has been exiled to work on a country farm.
ABC: Feds Backtrack on Transfer of Quarantined Coronavirus Patients to Alabama
ABC: Feds Backtrack on Transfer of Quarantined Coronavirus Patients to Alabama
Although North Korea has maintained that there is not a single coronavirus case within its borders, Kim and his government have employed drastic measures to prevent the coronavirus from entering the country, especially along the 880-mile-long border it shares with China. International traffic has been blocked and any visitors wishing to enter the capital city of Pyongyang will be screened.

FOX: California Lab Says it Discovered Coronavirus Vaccine in 3 Hours
FOX: California Lab Says it Discovered Coronavirus Vaccine in 3 Hours
Despite the country’s claim that there is not a single coronavirus case in North Korea, Bir Mandal of the UN Food and Agriculture Organization told Korea Biomed, told The Mirror:
“The North Korean authorities have told FAO that there are no cases of the new coronavirus, but we are suspicious of such claims.”
Harry Kazianis, director of Korean studies at the Center for National Interest, told Fox News:
“…there is no way that North Korea is not being impacted by the coronavirus. “They are clearly lying as they don’t want to show any weakness or that there is any threat to the regime. Considering how there are many porous sections of the North Korea-China border — and how the Kim regime depends on illegal trade to survive — it is clear the virus has come to North Korea.”
According to aid workers, North Korea’s dated health care system is ill-equipped to handle the novel virus. Nonetheless, North Korean health ministry official Song In Bom told state media that there are no coronavirus cases in the country, but that they would be prepared in the event that the outbreak spread. He said:
“Just because there is no case of the new coronavirus in our country, we should not be too relieved, but have civil awareness and work together for prevention.”
Harvard Medical School lecturer Kee Park has made many humanitarian trips to the impoverished country. He said it would struggle to manage an outbreak, telling the South China Morning Post:
“Perhaps they can manage to detect and treat small numbers, but an outbreak could likely easily overload the health system. Critical medical supplies are hard to import and vital equipment is unable to be repaired due to the difficulty in procuring parts.”
Novel Coronavirus — The Latest Pandemic Scare
Novel Coronavirus — The Latest Pandemic Scare
Nagi Shafik, former project manager for the WHO’s office in Pyongyang, said North Korean authorities would need supplies and antibiotics, adding:
“May I remind as well that many women and children suffer from malnutrition; these are factors that affect the immunity system and render humans more susceptible to infection.”
State media said Pyongyang was continuing the quarantine period for people showing symptoms to 30 days. All government institutions and foreigners living in the country were expected to comply “unconditionally.”
NY Post","Mar 1, 2020",https://www.healthnutnews.com/ny-post-north-korean-official-reportedly-executed-for-breaking-coronavirus-quarantine/
Neighbors Hold Porch Concert to Entertain Woman Self-Isolating Due to Coronavirus,"Helena Schlam, 78, usually spends her time going to concerts, book club meetings, exercise classes, and lunch with friends. Right now, however, she is trying to be reasonable and is self-isolating in her Clintonville home to avoid the novel coronavirus. 
Rebecca Tien lives across the street from Helena and called to check on her, which made Helena’s day.
Channel 4: Coronavirus: China Using App to Track Quarantined Citizens
Channel 4: Coronavirus: China Using App to Track Quarantined Citizens
Tien offered to have her children, 9-year-old Taran and 6-year-old Calliope, play their cellos for Helena. She said:
“I was looking at Helena’s long porch and I figured she could sit on one side and we could sit on the other and still be together,” Tien said.
Helena cheered “Bravo! Bravo!” as the two aspiring musicians finished their front porch performance. Rebecca Tien added:
“We had a great time too. It helps us fill our day so it’s mutually beneficial, for sure.”

FORBES: New York Is Making Its Own Hand Sanitizer Using Inmate Labor to Fight The Coronavirus Outbreak
FORBES: New York Is Making Its Own Hand Sanitizer Using Inmate Labor to Fight The Coronavirus Outbreak
Health experts caution that the fear and anxiety over the spread of the virus combined with isolation can lead to feelings of hopelessness and depression. Dr. Joseph Gastaldo, an infectious disease expert at OhioHealth, said:
“We’re all social people. We need social interaction and when we don’t see people face to face and we do it in a more sterile environment, that can lead to depression.”
WAVY","Mar 17, 2020",https://www.healthnutnews.com/neighbors-hold-porch-concert-to-entertain-woman-self-isolating-due-to-coronavirus/
USA Today: Concerns Over New Virus from China Prompt Rare Airport Screenings for Some Travelers,"Passengers traveling from Wuhan, China, to the United States will undergo entry screening at three U.S. airports for symptoms associated with a new coronavirus that has killed two people in Asia, the Centers for Disease Control and Prevention announced Friday. 
Screenings for 2019 Novel Coronavirus, or “2019-nCoV,” will occur at New York City’s JFK International Airport, Los Angeles International Airport and San Francisco International Airport. Approximately 100 additional CDC staff will be on hand to assist with the efforts.
Imported Luncheon Meat From China Tested Positive For African Swine Fever Virus
Imported Luncheon Meat From China Tested Positive For African Swine Fever Virus
Wuhan is the most populated city in central China, with roughly 11 million people. All three U.S. airports where the CDC screenings will take place have direct flights from Wuhan.

 
This is only the second time that the CDC has conducted airport screenings. The first was in 2014, in response to concerns over the Ebola virus, where health officials screened thousands of passengers from three West African countries for Ebola but identified no illnesses.
The CDC, citing Chinese health officials, said most of the patients affected have links to a seafood market, and at least one animal market, where authorities suspect they contracted the disease from an animal. The CDC added that some of the dozens of ill patients in the current 2019-nCoV outbreak might have contracted the disease from other people.
Is China ground zero for a future pandemic?
Is China ground zero for a future pandemic?
Officials estimated that about 5,000 passengers would go through the additional screening process in the next few weeks. Many countries in Asia have begun screening passengers on flights from central China.
The most common symptoms of the new coronavirus are fever, cough, and difficulty breathing. Lab tests ruled out MERS and SARS, as well as several other possible illnesses.
The World Health Organization reported on Thursday there have been two confirmed international cases of 2019-nCoV – one in Thailand and one in Japan, both from people who had traveled to Wuhan. More cases are expected in other countries.
The CDC said the risk from the illness to Americans is minimal and described the screening measures as “proactive preparedness precautions.”
USA Today","Jan 18, 2020",https://www.healthnutnews.com/concerns-over-new-virus-from-china-prompt-rare-airport-screenings-for-some-travelers/
"Updated Every Minute, 17-Year-Old Whiz Kid’s Coronavirus Site Used by Millions","A Seattle teenager has built a website that is keeping the world updated on the COVID-19 pandemic as it spreads. The site has been visited by 12 million people since it launched in late December.
Computer whiz Avi Schiffmann, 17, spends much of his time these days continually updating and improving his website, ncov2019.live, which automatically scrapes data from reliable sources from around the world. The site, which initially updated every ten minutes, now updates every minute to provide the latest statistics on the number of confirmed cases, severe cases, deaths, and recovered. And it does so in real-time both worldwide and in each country. 
FORBES: New York Is Making Its Own Hand Sanitizer Using Inmate Labor to Fight The Coronavirus Outbreak
FORBES: New York Is Making Its Own Hand Sanitizer Using Inmate Labor to Fight The Coronavirus Outbreak
The site also hosts an interactive Google map, a Twitter feed, travel advisories, information on the disease and its prevention, as well as tips for preparing for quarantine situations. Schiffman, a high school junior said:
“I started working on this project at Christmastime, when there were fewer than 1,000 confirmed cases — all in mainland China. It was hard to get clear, concise, and accurate information on what was going on, and I wanted to do something to fix this.”
Schiffmann undertook this project because it allowed him to learn web scraping technology. He said:
“It would also be a way to help with global health, which is something that’s needed when not all governments are the nicest or transparent, and it is hard to get information.”

Schiffmann’s website scrapes information from official government health organizations (local, national, and international), and trustworthy news outlets. He relies on an online community of news curators to help with this. He also coded the website to crosscheck data to make sure it is accurate, explaining:
“It’s all automated, so I don’t have to input anything manually. The web scraper runs even when I’m sleeping.”
Schiffman said he is getting 1,000 messages a day, ranging from PhDs with suggestions to media outlets hoping for an interview. 
Planned improvements to ncov2019.live include regional statistical breakdowns, graphs comparing the COVID-19 outbreak to historical pandemics, a vaccine tracker, and translation of the site to 30 different languages.
The English site has been visited online by every country on earth, with less than half from the United States.  As word has spread, the site has grown exponentially. It took a month to reach the first million, but in just the past 24 hours alone the site was visited by 3.2 million people. 
INDEPENDENT: Coronavirus: Space Images Reveal Drastic Fall in Pollution Over China as Factories Closed
INDEPENDENT: Coronavirus: Space Images Reveal Drastic Fall in Pollution Over China as Factories Closed
The teenager hopes to become a serial entrepreneur. He plans to take some time off after high school to travel the world to participate in hackathons. Not in it for the money, Schiffman said he wants to be creative and make an impact, proclaiming:
“I want to have the skills to make the next big thing, to change the world. I’m not interested in imitating anyone else. I want to be the next Avi Schiffmann.
I use coding like a painter uses a paintbrush. I like the technical aspect, but it’s a creative medium for me. I like making things and sharing them.” 
Schiffman shared that looking at a computer screen is not all that he enjoys. He also loves traveling and skis competitively.
NY Post: North Korean Official Reportedly Executed for Breaking Coronavirus Quarantine
NY Post: North Korean Official Reportedly Executed for Breaking Coronavirus Quarantine
Even though he’s received many internship and job offers from his coronavirus tracking website, Schiffman’s focus remains on the main objective of his project, which is to help, and not add to the growing panic as the virus spreads. He said:
“I have to admit that it is pretty scary, especially here in Seattle which is the epicenter from which the virus spread in this area. There have been a lot of school closures and cancellations of events. It’s a ghost town around here.”
Schiffmann said he was worried about the spread of misinformation, and blamed the media for causing unnecessary panic, adding:
“People should have preparedness plans and stock up in advance instead of going on panicked Costco runs now.”
The Times of Israel","Mar 11, 2020",https://www.healthnutnews.com/updated-every-minute-17-year-old-whiz-kids-coronavirus-site-used-by-millions/
FOX: California Lab Says it Discovered Coronavirus Vaccine in 3 Hours,"Inovio, an American biotech company, says it created a coronavirus vaccine three hours after getting access to the virus’ genetic sequence in mid-January. The company received $9 million to work on the vaccine from the Coalition for Epidemic Preparedness Innovations, which is backed by billionaire Bill Gates.
Inovio Pharmaceuticals is based in Pennsylvania, but scientists in its laboratory in San Diego made the discovery, and are racing to get the vaccine on the market in record time. Dr. J. Joseph Kim, Inovio’s president and CEO, told FOX Business:
“We were able to rapidly construct our vaccine in a matter of about three hours once we had the DNA sequence from the virus available because of the power of our DNA medicine platform. Our goal is to start phase one human testing in the U.S. early this summer.”
“We’ve done this many, many times before. The most relevant was building our vaccine against MERS virus, which is a coronavirus in the same family as COVID-19.”1
Novel Coronavirus — The Latest Pandemic Scare
Novel Coronavirus — The Latest Pandemic Scare

China has reported 254 new daily deaths and a spike in new daily virus cases of 15,152, after new methodology was put in place in Hubei, the hardest-hit province, as to how virus cases are categorized.
After announcing it was chosen to work on a coronavirus vaccine, Inovio’s stock jumped to $5.32 a share. The company is partnering with the Chinese company Beijing Advaccine to work on the vaccine.
Huawei Helps Fight Coronavirus by Building 5G Base Stations in Wuhan
Huawei Helps Fight Coronavirus by Building 5G Base Stations in Wuhan
Kim indicated Inovio had previously worked on the Zika virus, saying:
“Inovio took a vaccine for Zika virus from construct design to human testing in the U.S. in less than seven months. We’re planning to beat our own record. Maybe we could do that in close to half that time.”1
Inovio is building an alliance for the “war” against COVID-19 that will demand scaling up to thousands upon thousands of doses, Kim said.
Another U.S. company, Maryland-based Novavax, who made an Ebola vaccine in 90 days, is trying to make a coronavirus vaccine in as little as three months. However, such vaccines can take years to develop.
Fox Business","Feb 14, 2020",https://www.healthnutnews.com/california-lab-says-it-discovered-coronavirus-vaccine-in-3-hours/
Ibuprofen And COVID-19 Symptoms: Here’s What You Need to Know,"Living under the uncertainty of novel coronavirus (COVID-19) has sparked many concerns and questions worldwide. Though it is widely understood that the virus spreads rapidly and the nation is in the midst of a pandemic, people grapple with how to manage the emerging infection. Communities work to restrict the movement of people, and everyone is doing his or her part to social distance. But what to do if you in fact contract the illness? How do you best treat symptoms of COVID-19?
International researchers and healthcare professionals, working to provide us the most up to date information possible, are sharing some new tips in March 2020 to manage COVID-19 infections.
Ibuprofen: Can I Use It Or Not?
A recent concern prompted by a recommendation from the World Health Organization (WHO) over the use of ibuprofen during coronavirus infections has been rectified. As of March 18, 2020, WHO and other health groups around the globe okay the use of ibuprofen in the management of COVID-19 symptoms. Beyond the drug’s usual side effects, there are no known additional negative outcomes from managing COVID-19 symptoms with this common over-the-counter medication (also referred to as Motrin or Advil).
The classification of ibuprofen is a non-steroidal anti-inflammatory drug, or for short, NSAIDs. NSAIDs are not ideal drugs for everyone and are, therefore, not recommended for everyone. Specifically, NSAIDs should not be taken by those with diminished circulation, heart disease, and a history of gastrointestinal bleeding.
As effective as Ibuprofen, is it in your pantry?
As effective as Ibuprofen, is it in your pantry?
What Does The Research Say?
There has been past research indicating that some respiratory infections and diseases (ie. asthma) can worsen symptoms and cause greater complications when treated with ibuprofen. An explanation as to why this happens is not clear. But some experts believe ibuprofen ‘dampens’ the body’s immune response. However, it must be noted that no such evidence exists for COVID-19.
Professor Parastou Donyai at the University of Reading reinforced this sentiment when speaking to BBC on March 17, 2020. She said, “I have not seen any scientific evidence that clearly shows a totally healthy 25-year-old taking ibuprofen for symptoms of COVID-19 is putting themselves at additional risk of complications.”

What About Acetaminophen?
Both acetaminophen and ibuprofen are well-known medications to treat fevers, diminish body aches, and manage other flu-like symptoms. As an NSAID, patients with multiple health conditions or the elderly are being urged by some doctors to be assessed for ibuprofen use on a case-by-case basis during the coronavirus outbreak. Meanwhile, acetaminophen (not an NSAID) remains a safe choice for nearly everyone impacted by infection. Acetaminophen (ie.Tylenol), tends to be an especially great supplement to other cold and flu medications. A maximum dose of acetaminophen in 24 hours is 3,000 milligrams for adults.
If I Get Coronavirus, What About My Other Regular Medications?
Like ibuprofen, some misinformation has been circulating online regarding heart and asthma medications. Of particular concerns, heart medications classified as angiotensin-converting enzyme (ACE) inhibitors and angiotensin receptor blockers (ARBs) are thought to worsen COVID-19 symptoms. ACE and ARB medications are often prescribed daily to treat high blood pressure (hypertension), improve heart function, and in some cases, prompt kidney function.
As of March 24, 2020, the American Heart Association (AHA), the American College of Cardiology (ACC), and the Heart Failure Society of America (HFSA) strongly recommend that people taking these medications should continue to do so, even if they become infected with the coronavirus. There is little human research to show that ACE and ARBs medications actually worsen lung function during respiratory infections. As well, stopping your ACE or ARBs places you at greater risk of complications. In the case of an infection, untreated hypertension and decreased heart function can strain your cardiovascular system.
As of now, nobody taking regular medication – especially for heart or lung disease – is recommended to stop these treatments. If you have concerns, speak to a trusted healthcare provider.
Acetaminophen – Not Worth the Risk, by the Children’s Health Defense Team
Acetaminophen – Not Worth the Risk, by the Children’s Health Defense Team
In Case of Infection, Rely on Reputable Sources
Ultimately, not much is known and new information is emerging daily about coronavirus. During this time, ensure you are seeking information about the management of COVID-19 from reputable sources. Turning to the WHO for regular updates is a particularly great strategy. Do not seek health information from social media outlets like a Facebook post or WhatsApp message. Seemingly casual speculation can likewise perpetuate rumors and false knowledge.
If you develop signs of COVID-19 rely on your local health authority. Common signs of coronavirus include fever, sore throat, cough, aches, congestion, a tight chest, and shortness of breath. It is important that we follow information coming from health experts, governments, and researchers in the coming days.
*Article originally appeared at Healthy Holistic Living.","Mar 25, 2020",https://www.healthnutnews.com/ibuprofen-and-covid-19-symptoms-heres-what-you-need-to-know/
"According to local officials, FEMA Facility Will No Longer Be Used as Coronavirus Quarantine Center","Editor’s note: Update. Since we reported on the national news story that coronavirus patients would be housed at a FEMA camp in the state of Alabama, local elected officials have announced this will, in fact, not happen after all. 
 Locals (along with politicians) stated they didn’t want these infected people housed at FEMA camps in their states. Alabama Senator Shelby, Governor Kay Ivey and Congressman Mike Rogers (AL-03) have all  tweeted that they have respectively spoken with the president over the phone on Sunday afternoon. In those phone calls, Trump reportedly affirmed that the patients will not be coming to Alabama.
 
The U.S. Department of Health and Human Services announced on Saturday that American passengers evacuated from the Diamond Princess cruise ship in Japan would be quarantined at the FEMA Center for Domestic Preparedness in Anniston, Alabama.
Passengers who will stay at the Alabama federal facility have tested positive for the coronavirus (COVID-19) but are not currently showing symptoms. If they become seriously ill, they will be taken to pre-vetted hospitals for medical care. The patients are expected to be transported to the facility this week.
FOX: California Lab Says it Discovered Coronavirus Vaccine in 3 Hours
FOX: California Lab Says it Discovered Coronavirus Vaccine in 3 Hours

Novel Coronavirus — The Latest Pandemic Scare
Novel Coronavirus — The Latest Pandemic Scare
Read the entire HHS statement below:
HHS is taking precautions to protect the health of all Americans from Coronavirus Disease 2019 (COVID-19). To that end, HHS and FEMA agreed to use a federal facility, the FEMA Center for Domestic Preparedness in Anniston, Alabama, as a place for some of the American passengers from the Diamond Princess to stay. These are passengers whom the federal government evacuated back to the U.S. from the Diamond Princess cruise ship in Japan.
The passengers who will stay at the Center tested positive for COVID-19, although at this time they either do not have symptoms or have mild flu-like symptoms. Any of the evacuees who become seriously ill will be transported to pre-identified hospitals for medical care. Under the HHS-FEMA agreement, the Center for Domestic Preparedness will provide the housing, and HHS will provide basic medical care and all other support services for these returning passengers. Passengers will stay in a separate area from the Center’s training participants and will remain at the Center until they are medically cleared.1
The Center has unique facilities and routinely offers week-long, hands-on training for large groups of professionals from federal, state and local emergency management agencies, hospitals, public health agencies, and law enforcement agencies on disaster response.
FEMA’s Center for Domestic Preparedness (CDP) in Anniston is one of the country’s most advanced training sites for health and medical education in disasters. The facility trains first responders from around the country year-round.
At a news conference Saturday, Anniston Mayor Jack Draper said that city and county leaders were taken entirely by surprise at the news on Saturday and that the decision was the federal government’s. He indicated they were not asked for permission.
Huawei Helps Fight Coronavirus by Building 5G Base Stations in Wuhan
Huawei Helps Fight Coronavirus by Building 5G Base Stations in Wuhan
Mayor Draper said they were assured by the federal government that the community would not have any impact whatsoever from the patients being held at the facility. He is, however, “concerned” they weren’t made aware of the plan earlier.
Draper also stressed that the patients would be kept entirely separate from the people training at the facility and that the patients would not be allowed to leave the facility until they’re medically cleared to do so.
At the same news conference, Calhoun County Commission Chairman Tim Hodges said that he intends to look at legal steps that could be taken to block the patients from being brought to the facility.
ABC","Feb 24, 2020",https://www.healthnutnews.com/abc-fema-facility-will-be-used-as-coronavirus-quarantine-center/
