title,content,publishedAt,url
CNBC: J&J Scientific Officer ‘Pretty Confident’ They can Create Coronavirus Vaccine as Outbreak Widens,"The coronavirus has quickly become the focus of worldwide attention. The virus is said to cause flu-like symptoms, and most likely spread into the human population from an infected animal at a market in Wuhan, China.
Several countries are reporting coronavirus cases, including the United States, which on Sunday confirmed a fifth case. Officials have confirmed that the virus has been transmitted from person to person. However, it is still unclear how easy it is to contract it from another individual.
CNBC reports that on Monday, Johnson & Johnson’s chief scientific officer, Dr. Paul Stoffels, expressed his optimism that the drug maker could create a vaccine in the coming months to fight against the fast-spreading coronavirus.
Netflix Viewers Freaked Out as ‘Pandemic’ Documentary Happens to Drop Amid Coronavirus Outbreak
Netflix Viewers Freaked Out as ‘Pandemic’ Documentary Happens to Drop Amid Coronavirus Outbreak

USA Today: Concerns Over New Virus from China Prompt Rare Airport Screenings for Some Travelers
USA Today: Concerns Over New Virus from China Prompt Rare Airport Screenings for Some Travelers
Stoffel said it could take up to a year to bring it to market, but there is hope that the company could shave two to three months off of that due to technological advances, adding:
“We have dozens of scientists working on this so we’re pretty confident we can get something made that will work and stay active for the longer term. We’ll see in the next few weeks how this goes.”
Stoffels confirmed the company started working on a coronavirus vaccine two weeks ago. Chinese officials said there are now more than 2,800 confirmed cases of the flu-like coronavirus, with the death toll rising to 81. According to the World Health Organization, the new strain comes from a large family of viruses known as coronaviruses.
Pandemic ‘could wipe out 900 million people,’ experts warn
Pandemic ‘could wipe out 900 million people,’ experts warn
They are known to cause illness ranging from the common cold to more severe diseases. On Sunday, authorities temporarily banned the trade of wild animals in China. Several companies, including Walt Disney’s Shanghai Disney, are suspending operations until further notice, to prevent the outbreak from spreading. This is especially unusual, as this comes during the ordinarily festive week-long Lunar New Year holiday. Starbucks and McDonald’s also closed stores in Hubei province.
Accordong to Stoffel, this vaccine required the pharmaceutical company to start from scratch. As for the road ahead, he said:
“We are going to take an approach with at least five different constructs and different partners and collaborations all over the world in order to see which part of the virus we can use to make an effective vaccine and develop a model that we can invest in.”
In response to the uproar surrounding the virus, Stoffels commented that the speed at which it is spreading is “scary,” but doesn’t constitute panic. He said:
“But at the same time, I’m very worried that this could become a global pandemic. That’s why we started working on this vaccine two weeks ago, we have to be prepared that this is going to become a global crisis.”
CNBC","Jan 28, 2020",https://www.healthnutnews.com/jj-scientific-officer-pretty-confident-they-can-create-coronavirus-vaccine-as-outbreak-widens/
A Miami Man Who Flew to China Worried He Might Have Coronavirus. He May Owe Thousands.,"Last month, Miami resident Osmel Martinez Azcue returned from a work trip in China with flu-like symptoms. Being cautious, he went to the hospital to make sure he didn’t have the coronavirus.
The tests concluded that Azcue had the flu, not the coronavirus. Two weeks after his test, he received a claim for $3,270. With limited insurance coverage, he will be responsible for about $1,400 of that bill. Azcue told the Miami Herald:
“How can they expect normal citizens to contribute to eliminating the potential risk of person-to-person spread if hospitals are waiting to charge us $3,270 for a simple blood test and a nasal swab?”
Hospital officials at Jackson Memorial Hospital, where Azcue was seen, told the Miami Herald that in addition to the bill, he would also have to provide three years of medical records to prove the flu he got didn’t relate to a preexisting condition.
Survey: Half of doctors considering leaving medicine — because of health insurance headaches
Survey: Half of doctors considering leaving medicine — because of health insurance headaches
Georgetown University professor and codirector of the Center on Health Insurance Reforms, Sabrina Corlette, told the Herald:
“That’s the critical difference between [Affordable Care Act] plans and junk plans. [Junk plans] will not cover pre-existing conditions.”
Azcue said he earns approximately $55,000 a year working for a medical-device company that does not offer health insurance. He said he was covered under an Affordable Care Act-compliant plan last year that cost him about $278 in monthly premiums, but that shot up to $400 a month when his annual salary kicked in. He canceled his plan in November and now pays $180 per month for a limited plan from National General Insurance.
NY Post: North Korean Official Reportedly Executed for Breaking Coronavirus Quarantine
NY Post: North Korean Official Reportedly Executed for Breaking Coronavirus Quarantine

FOX: California Lab Says it Discovered Coronavirus Vaccine in 3 Hours
FOX: California Lab Says it Discovered Coronavirus Vaccine in 3 Hours
Corlette said Azcue’s case was a cautionary tale of deregulation in the insurance market, adding:
“When someone has flu-like symptoms, you want them to seek medical care. If they have one of these junk plans and they know they might be on the hook for more than they can afford to seek that care, a lot of them just won’t, and that is a public health concern.”
In 2018, “junk plans” were allowed in the market. Some consumers wrongly think plans with lower monthly costs will be better than no insurance at all, but often the plans aren’t much different from going without insurance altogether, the Herald reported.
When Azcue decided to go to a hospital for screening, instead of to a pharmacy for over-the-counter flu medicine, he felt it was the responsible choice. Nonetheless, he was concerned about how much the visit would cost him.
Novel Coronavirus — The Latest Pandemic Scare
When staff members told him he’d need a CT scan to screen for the coronavirus, Azcue asked for a flu test first. Azcue told the Herald he said at the hospital:
“This will be out of my pocket. Let’s start with the blood test, and if I test positive, just discharge me.”
Jackson Health officials told the Herald that there were even more bills for Azcue on the way, and it is not clear what the final total will be.
Miami Herald","Mar 5, 2020",https://www.healthnutnews.com/a-miami-man-who-flew-to-china-worried-he-might-have-coronavirus-he-may-owe-thousands/
ABC: Feds Backtrack on Transfer of Quarantined Coronavirus Patients to Alabama,"Plans to move American coronavirus patients to the FEMA Center for Domestic Preparedness in Anniston, Alabama were canceled Sunday after local officials and residents expressed concerns.
The federal government assured the Calhoun County Emergency Management Agency that the coronavirus patients would be isolated in the Anniston FEMA facility and that they would pose no threat to residents.
Nevertheless, on Sunday, the City Council in Anniston County voted to seek legal action against the federal government over its plan to transfer patients from the Diamond Princess cruise ship to the town’s facility for quarantine. Just hours later, U.S. Sen. Richard Shelby and Gov. Kay Ivey announced on Twitter that plans had changed.
Alabama FEMA facility will be used as coronavirus quarantine center
Alabama FEMA facility will be used as coronavirus quarantine center

FOX: California Lab Says it Discovered Coronavirus Vaccine in 3 Hours
FOX: California Lab Says it Discovered Coronavirus Vaccine in 3 Hours
Ivey stated President Trump called her and assured her that the patients who were aboard the Diamond Princess would not be coming to Alabama. Ivy tweeted:
“I thanked him for his support of AL! We always want to help our fellow Americans, but this wasn’t fully vetted.”
The Diamond Princess docked at the Japanese port of Yokohama on Feb. 3 and was placed under quarantine after passengers and crew showed coronavirus symptoms.
As of Sunday, there were 634 confirmed coronavirus cases aboard Diamond Princess, with two deaths. The U.S. government evacuated 300 American passengers to the U.S. last week, 14 of whom tested positive for the virus.
Novel Coronavirus — The Latest Pandemic Scare
Novel Coronavirus — The Latest Pandemic Scare
According ot Ivy, the Anniston facility was being considered as a “back up” location in case patients couldn’t be moved to other quarantine locations.
During their council meeting, some councilmembers had mixed feelings about the situation. Councilmember Jay Jenkins agreed that the town should receive more information from the federal government about the transfer, but reiterated that the patients are helpless Americans who need immediate care.
Huawei Helps Fight Coronavirus by Building 5G Base Stations in Wuhan
Huawei Helps Fight Coronavirus by Building 5G Base Stations in Wuhan
Anniston wasn’t the only American city protesting against plans to house quarantined patients. On Friday, Judge Josephine Staton in Costa Mesa, California issued a temporary restraining order against the federal government to block it from transferring coronavirus patients to a quarantine site in his town.
Just like in Anniston, officials from the Costa Mesa said they were not properly informed about the federal government’s plans.
ABC","Feb 26, 2020",https://www.healthnutnews.com/abc-feds-backtrack-on-transfer-of-quarantined-coronavirus-patients-to-alabama/
